[gabriel@archlinux fl2000_drm_kernel7.1]$ make clean && make 
make -C /lib/modules/7.1.3-arch1-3/build M=/home/gabriel/driver/fl2000_drm_kernel7.1 clean
make[1]: Entering directory '/usr/lib/modules/7.1.3-arch1-3/build'
make[2]: Entering directory '/home/gabriel/driver/fl2000_drm_kernel7.1'
  CLEAN   Module.symvers
make[2]: Leaving directory '/home/gabriel/driver/fl2000_drm_kernel7.1'
make[1]: Leaving directory '/usr/lib/modules/7.1.3-arch1-3/build'
rm -f /home/gabriel/driver/fl2000_drm_kernel7.1/Module.symvers /home/gabriel/driver/fl2000_drm_kernel7.1/*.ur-safe
make CHECK="/usr/bin/sparse" -C /lib/modules/7.1.3-arch1-3/build M=/home/gabriel/driver/fl2000_drm_kernel7.1 modules
make[1]: Entering directory '/usr/lib/modules/7.1.3-arch1-3/build'
make[2]: Entering directory '/home/gabriel/driver/fl2000_drm_kernel7.1'
  CC [M]  fl2000_drv.o
  CC [M]  fl2000_registers.o
  CC [M]  fl2000_interrupt.o
  CC [M]  fl2000_streaming.o
  CC [M]  fl2000_i2c.o
  CC [M]  fl2000_drm.o
  CC [M]  bridge/it66121_drv.o
  LD [M]  fl2000.o
  MODPOST Module.symvers
  CC [M]  fl2000.mod.o
  CC [M]  .module-common.o
  LD [M]  fl2000.ko
  BTF [M] fl2000.ko
make[2]: Leaving directory '/home/gabriel/driver/fl2000_drm_kernel7.1'
make[1]: Leaving directory '/usr/lib/modules/7.1.3-arch1-3/build'
[gabriel@archlinux fl2000_drm_kernel7.1]$ sudo rmmod fl2000 2>/dev/null 
[sudo] password for gabriel: 
[gabriel@archlinux fl2000_drm_kernel7.1]$  sudo mkdir -p /lib/modules/$(uname -r)/extra

sudo cp fl2000.ko /lib/modules/$(uname -r)/extra/

sudo depmod -a 
[gabriel@archlinux fl2000_drm_kernel7.1]$ sudo modprobe fl2000 
[gabriel@archlinux fl2000_drm_kernel7.1]$  echo '1d5c:2000:i' | sudo tee /sys/module/usb_storage/parameters/quirks

cat /sys/module/usb_storage/parameters/quirks
tee: /sys/module/usb_storage/parameters/quirks: No such file or directory
1d5c:2000:i
cat: /sys/module/usb_storage/parameters/quirks: No such file or directory
[gabriel@archlinux fl2000_drm_kernel7.1]$ sudo modprobe usb-storage
[gabriel@archlinux fl2000_drm_kernel7.1]$ echo '1d5c:2000:i' | sudo tee /sys/module/usb_storage/parameters/quirks
1d5c:2000:i
[gabriel@archlinux fl2000_drm_kernel7.1]$ cat /sys/module/usb_storage/parameters/quirks
1d5c:2000:i

[gabriel@archlinux fl2000_drm_kernel7.1]$ echo 'module fl2000 +p' | sudo tee /sys/kernel/debug/dynamic_debug/control 
module fl2000 +p
[gabriel@archlinux fl2000_drm_kernel7.1]$ echo 0x1f | sudo tee /sys/module/drm/parameters/debug 
0x1f
[gabriel@archlinux fl2000_drm_kernel7.1]$ echo 0 | sudo tee /sys/module/drm/parameters/debug 
0
[gabriel@archlinux fl2000_drm_kernel7.1]$ lsusb -d 1d5c:2000 -v 2>&1 | head -60
Couldn't open device, some information will be missing

Bus 002 Device 003: ID 1d5c:2000 Fresco Logic FL2000/FL2000DX VGA/DVI/HDMI Adapter
Negotiated speed: SuperSpeed (5Gbps)
Device Descriptor:
  bLength                18
  bDescriptorType         1
  bcdUSB               3.00
  bDeviceClass          239 Miscellaneous Device
  bDeviceSubClass         2 [unknown]
  bDeviceProtocol         1 Interface Association
  bMaxPacketSize0         9
  idVendor           0x1d5c Fresco Logic
  idProduct          0x2000 FL2000/FL2000DX VGA/DVI/HDMI Adapter
  bcdDevice            2.00
  iManufacturer           0 
  iProduct                0 
  iSerial                 0 
  bNumConfigurations      1
  Configuration Descriptor:
    bLength                 9
    bDescriptorType         2
    wTotalLength       0x0297
    bNumInterfaces          4
    bConfigurationValue     1
    iConfiguration          0 
    bmAttributes         0x80
      (Bus Powered)
    MaxPower              496mA
    Interface Association:
      bLength                 8
      bDescriptorType        11
      bFirstInterface         0
      bInterfaceCount         3
      bFunctionClass         14 Video
      bFunctionSubClass       1 Video Control
      bFunctionProtocol       3 
      iFunction               0 
    Interface Descriptor:
      bLength                 9
      bDescriptorType         4
      bInterfaceNumber        0
      bAlternateSetting       0
      bNumEndpoints           0
      bInterfaceClass        16 Audio/Video
      bInterfaceSubClass      0 [unknown]
      bInterfaceProtocol      0 
      iInterface              0 
    Interface Descriptor:
      bLength                 9
      bDescriptorType         4
      bInterfaceNumber        0
      bAlternateSetting       1
      bNumEndpoints           2
      bInterfaceClass        16 Audio/Video
      bInterfaceSubClass      0 [unknown]
      bInterfaceProtocol      0 
      iInterface              0 
      ** UNRECOGNIZED:  04 21 00 01
      ** UNRECOGNIZED:  06 25 01 00 00 00
[gabriel@archlinux fl2000_drm_kernel7.1]$ udevadm monitor --kernel --property
monitor will print the received events for:
KERNEL - the kernel uevent

^C[gabriel@archlinux fl2000_drm_kernel7.1]$ ls /sys/class/drm/
card0  card0-HDMI-A-2  card1  card1-eDP-1  card1-HDMI-A-1  renderD128  version
[gabriel@archlinux fl2000_drm_kernel7.1]$ for f in /sys/class/drm/card*-*/status; do echo "$f: $(cat $f)"; done
/sys/class/drm/card0-HDMI-A-2/status: connected
/sys/class/drm/card1-eDP-1/status: connected
/sys/class/drm/card1-HDMI-A-1/status: connected
[gabriel@archlinux fl2000_drm_kernel7.1]$ sudo cat /sys/kernel/debug/dri/*/state
cat: '/sys/kernel/debug/dri/*/state': No such file or directory
[gabriel@archlinux fl2000_drm_kernel7.1]$  sudo pacman -S --needed edid-decode drm_info

cat /sys/class/drm/card*-HDMI*/edid | edid-decode 
error: target not found: edid-decode
error: target not found: drm_info
edid-decode (hex):

00 ff ff ff ff ff ff 00 5a 63 40 e9 88 88 18 30
14 23 01 03 80 35 1d 78 ea 31 35 a5 55 4e a1 26
0c 50 54 bf ef 80 71 4f 81 40 81 80 81 c0 81 00
95 00 b3 00 31 40 02 3a 80 18 71 38 2d 40 58 2c
45 00 0f 28 21 00 00 1e 00 00 00 fd 00 30 64 1e
78 1e 00 0a 20 20 20 20 20 20 00 00 00 fc 00 56
41 32 34 30 2d 46 48 44 0a 20 20 20 00 00 00 ff
00 58 4e 45 32 35 32 30 32 30 34 37 30 0a 01 84

02 03 21 b2 47 01 03 04 90 12 13 9f 83 01 00 00
67 03 0c 00 10 00 38 3c 68 1a 00 00 01 01 30 64
e6 2a 44 80 a0 70 38 27 40 30 20 35 00 00 00 00
00 00 1a 06 5a 80 a0 70 38 1c 40 30 20 35 00 00
00 00 00 00 1a 00 00 00 00 00 00 00 00 00 00 00
00 00 00 00 00 00 00 00 00 00 00 00 00 00 00 00
00 00 00 00 00 00 00 00 00 00 00 00 00 00 00 00
00 00 00 00 00 00 00 00 00 00 00 00 00 00 00 aa

----------------

Block 0, Base EDID:
  EDID Structure Version & Revision: 1.3
  Vendor & Product Identification:
    Manufacturer: VSC
    Model: 59712
    Serial Number: 806914184 (0x30188888)
    Made in: week 20 of 2025
  Basic Display Parameters & Features:
    Digital display
    Maximum image size: 53 cm x 29 cm
    Gamma: 2.20
    DPMS levels: Standby Suspend Off
    RGB color display
    First detailed timing is the preferred timing
  Color Characteristics:
    Red  : 0.6445, 0.3349
    Green: 0.3046, 0.6298
    Blue : 0.1484, 0.0498
    White: 0.3134, 0.3291
  Established Timings I & II:
    IBM     :   720x400    70.081663 Hz   9:5     31.467 kHz     28.320000 MHz
    DMT 0x04:   640x480    59.940476 Hz   4:3     31.469 kHz     25.175000 MHz
    Apple   :   640x480    66.666667 Hz   4:3     35.000 kHz     30.240000 MHz
    DMT 0x05:   640x480    72.808802 Hz   4:3     37.861 kHz     31.500000 MHz
    DMT 0x06:   640x480    75.000000 Hz   4:3     37.500 kHz     31.500000 MHz
    DMT 0x08:   800x600    56.250000 Hz   4:3     35.156 kHz     36.000000 MHz
    DMT 0x09:   800x600    60.316541 Hz   4:3     37.879 kHz     40.000000 MHz
    DMT 0x0a:   800x600    72.187572 Hz   4:3     48.077 kHz     50.000000 MHz
    DMT 0x0b:   800x600    75.000000 Hz   4:3     46.875 kHz     49.500000 MHz
    Apple   :   832x624    74.551266 Hz   4:3     49.726 kHz     57.284000 MHz
    DMT 0x10:  1024x768    60.003840 Hz   4:3     48.363 kHz     65.000000 MHz
    DMT 0x11:  1024x768    70.069359 Hz   4:3     56.476 kHz     75.000000 MHz
    DMT 0x12:  1024x768    75.028582 Hz   4:3     60.023 kHz     78.750000 MHz
    DMT 0x24:  1280x1024   75.024675 Hz   5:4     79.976 kHz    135.000000 MHz
    Apple   :  1152x870    75.061550 Hz 192:145   68.681 kHz    100.000000 MHz
  Standard Timings:
    DMT 0x15:  1152x864    75.000000 Hz   4:3     67.500 kHz    108.000000 MHz
    DMT 0x20:  1280x960    60.000000 Hz   4:3     60.000 kHz    108.000000 MHz
    DMT 0x23:  1280x1024   60.019740 Hz   5:4     63.981 kHz    108.000000 MHz
    DMT 0x55:  1280x720    60.000000 Hz  16:9     45.000 kHz     74.250000 MHz
    DMT 0x1c:  1280x800    59.810326 Hz  16:10    49.702 kHz     83.500000 MHz
    DMT 0x2f:  1440x900    59.887445 Hz  16:10    55.935 kHz    106.500000 MHz
    DMT 0x3a:  1680x1050   59.954250 Hz  16:10    65.290 kHz    146.250000 MHz
    DMT 0x04:   640x480    59.940476 Hz   4:3     31.469 kHz     25.175000 MHz
  Detailed Timing Descriptors:
    DTD 1:  1920x1080   60.000000 Hz  16:9     67.500 kHz    148.500000 MHz (527 mm x 296 mm)
                 Hfront   88 Hsync  44 Hback  148 Hpol P
                 Vfront    4 Vsync   5 Vback   36 Vpol P
    Display Range Limits:
      Monitor ranges (GTF): 48-100 Hz V, 30-120 kHz H, max dotclock 300 MHz
    Display Product Name: 'VA240-FHD'
    Display Product Serial Number: 'XNE252020470'
  Extension blocks: 1
Checksum: 0x84

----------------

Block 1, CTA-861 Extension Block:
  Revision: 3
  Underscans IT Video Formats by default
  Supports YCbCr 4:4:4
  Supports YCbCr 4:2:2
  Native detailed modes: 2
  Video Data Block:
    VIC   1:   640x480    59.940476 Hz   4:3     31.469 kHz     25.175000 MHz
    VIC   3:   720x480    59.940060 Hz  16:9     31.469 kHz     27.000000 MHz
    VIC   4:  1280x720    60.000000 Hz  16:9     45.000 kHz     74.250000 MHz
    VIC  16:  1920x1080   60.000000 Hz  16:9     67.500 kHz    148.500000 MHz (native)
    VIC  18:   720x576    50.000000 Hz  16:9     31.250 kHz     27.000000 MHz
    VIC  19:  1280x720    50.000000 Hz  16:9     37.500 kHz     74.250000 MHz
    VIC  31:  1920x1080   50.000000 Hz  16:9     56.250 kHz    148.500000 MHz (native)
  Speaker Allocation Data Block:
    FL/FR - Front Left/Right
  Vendor-Specific Data Block (HDMI), OUI 00-0C-03:
    Source physical address: 1.0.0.0
    DC_36bit
    DC_30bit
    DC_Y444
    Maximum TMDS clock: 300 MHz
  Vendor-Specific Data Block (AMD), OUI 00-00-1A:
    Version: 1
    Feature Caps: 0x01
    Minimum Refresh Rate: 48 Hz
    Maximum Refresh Rate: 100 Hz
    Flags 1.x: 0xe6 (MCCS)
  Detailed Timing Descriptors:
    DTD 2:  1920x1080   74.972503 Hz  16:9     83.894 kHz    174.500000 MHz
                 Hfront   48 Hsync  32 Hback   80 Hpol P
                 Vfront    3 Vsync   5 Vback   31 Vpol N
    DTD 3:  1920x1080   99.998264 Hz  16:9    110.798 kHz    230.460000 MHz
                 Hfront   48 Hsync  32 Hback   80 Hpol P
                 Vfront    3 Vsync   5 Vback   20 Vpol N
Checksum: 0xaa  Unused space in Extension Block: 58 bytes
[gabriel@archlinux fl2000_drm_kernel7.1]$ drm_info
bash: drm_info: command not found
[gabriel@archlinux fl2000_drm_kernel7.1]$ kscreen-doctor -o
bash: kscreen-doctor: command not found
[gabriel@archlinux fl2000_drm_kernel7.1]$ xrandr --listproviders && xrandr
WARNING: running xrandr against an Xwayland server. See the xrandr man page for details.
Providers: number : 0
WARNING: running xrandr against an Xwayland server. See the xrandr man page for details.
Screen 0: minimum 16 x 16, current 3840 x 1080, maximum 32767 x 32767
HDMI-1 connected 1920x1080+0+0 (normal left inverted right x axis y axis) 530mm x 290mm
   1920x1080     59.96*+
   1440x1080     59.99  
   1400x1050     59.98  
   1280x1024     59.89  
   1280x960      59.94  
   1152x864      59.96  
   1024x768      59.92  
   800x600       59.86  
   640x480       59.38  
   320x240       59.29  
   1680x1050     59.95  
   1440x900      59.89  
   1280x800      59.81  
   1152x720      59.97  
   960x600       59.63  
   928x580       59.88  
   800x500       59.50  
   768x480       59.90  
   720x480       59.71  
   640x400       59.95  
   320x200       58.14  
   1600x900      59.95  
   1368x768      59.88  
   1280x720      59.86  
   1024x576      59.90  
   864x486       59.92  
   720x400       59.27  
   640x350       59.28  
eDP-1 connected primary 1920x1080+1920+0 (normal left inverted right x axis y axis) 340mm x 190mm
   1920x1080     59.96*+
   1440x1080     59.99  
   1400x1050     59.98  
   1280x1024     59.89  
   1280x960      59.94  
   1152x864      59.96  
   1024x768      59.92  
   800x600       59.86  
   640x480       59.38  
   320x240       59.29  
   1680x1050     59.95  
   1440x900      59.89  
   1280x800      59.81  
   1152x720      59.97  
   960x600       59.63  
   928x580       59.88  
   800x500       59.50  
   768x480       59.90  
   720x480       59.71  
   640x400       59.95  
   320x200       58.14  
   1600x900      59.95  
   1368x768      59.88  
   1280x720      59.86  
   1024x576      59.90  
   864x486       59.92  
   720x400       59.27  
   640x350       59.28  


